{
  "schema_version": "0.2.0",
  "project_id": "campus-sensing-beta-2026-06",
  "title": "校园感知 Beta 2026-06 / Campus Sensing Beta 2026-06",
  "summary": "14 天邀请制免费 Beta 的公开草案包，用于发布审核后的校园微气候与声景聚合成果。",
  "status": "draft",
  "public_issue": "https://github.com/Francis-LQ/ocpc-civic-sensing-lab/issues/11",
  "maintainers": [
    "Francis-LQ"
  ],
  "themes": [
    "microclimate",
    "soundscape",
    "campus-sensing-beta"
  ],
  "protocols": [
    "每位参与者至少完成 3 个模糊分区 × 2 个时段",
    "手机 dB 读数仅用于同一设备内相对比较",
    "公开包只接收审核后的聚合数据、匿名页面和去标识化文字"
  ],
  "licenses": {
    "code": "MulanPSL-2.0",
    "documents": "MulanOWL-BY-SA-1.0",
    "data": "NOASSERTION"
  },
  "public_artifacts": [
    {
      "path": "README.md",
      "type": "documentation"
    },
    {
      "path": "CONTRIBUTORS.md",
      "type": "contributor-record"
    },
    {
      "path": "RISK_AND_PRIVACY.md",
      "type": "safety-review"
    },
    {
      "path": "PROTOCOL.md",
      "type": "sampling-protocol"
    },
    {
      "path": "RUBRIC.md",
      "type": "learning-rubric"
    },
    {
      "path": "RELEASE_CANDIDATE_CHECKLIST.md",
      "type": "publication-checklist"
    },
    {
      "path": "RETROSPECTIVE_TEMPLATE.md",
      "type": "retrospective-template"
    },
    {
      "path": "artifacts/observation-template.csv",
      "type": "observation-template"
    },
    {
      "path": "artifacts/public-aggregation-template.csv",
      "type": "aggregation-template"
    }
  ],
  "safety_and_data_release": {
    "minors_personal_data_included": false,
    "contact_information_included": false,
    "precise_locations_included": false,
    "unauthorized_raw_data_included": false,
    "public_data_scope": "当前仅包含公开草案、空白模板和发布门禁；真实发布时仅包含审核后的去标识化聚合数据和获授权公开成果。",
    "reviewed_by": "Francis-LQ",
    "reviewed_on": "2026-06-04"
  },
  "publication_review": {
    "status": "draft",
    "reviewed_by": "Francis-LQ",
    "reviewed_on": "2026-06-04",
    "private_paths_included": false,
    "minors_original_audio_included": false,
    "identifiable_conversations_included": false,
    "withdrawal_mapping_recorded": false
  }
}
