{
  "schema_version": "0.2.0",
  "project_id": "campus-sensing-combo",
  "title": "校园感知组合 / Campus Sensing Combo",
  "summary": "使用完全合成的数据演示校园微气候与声景并行观察、聚合展示和安全发布流程。",
  "status": "active",
  "public_issue": "https://github.com/Francis-LQ/ocpc-civic-sensing-lab/issues/new",
  "maintainers": [
    "Francis-LQ"
  ],
  "themes": [
    "microclimate",
    "soundscape"
  ],
  "protocols": [
    "3 个模糊分区 × 2 个时段",
    "手机 dB 读数仅用于设备内相对比较",
    "本示例不包含真实参与者、原音频或精确位置"
  ],
  "licenses": {
    "code": "MulanPSL-2.0",
    "documents": "MulanOWL-BY-SA-1.0",
    "data": "MulanOWL-BY-SA-1.0"
  },
  "public_artifacts": [
    {
      "path": "README.md",
      "type": "documentation"
    },
    {
      "path": "CONTRIBUTORS.md",
      "type": "contributor-record"
    },
    {
      "path": "RISK_AND_PRIVACY.md",
      "type": "safety-review"
    },
    {
      "path": "PROTOCOL.md",
      "type": "sampling-protocol"
    },
    {
      "path": "RUBRIC.md",
      "type": "learning-rubric"
    },
    {
      "path": "artifacts/synthetic-observations.csv",
      "type": "synthetic-observations"
    },
    {
      "path": "artifacts/synthetic-summary.csv",
      "type": "synthetic-summary"
    },
    {
      "path": "participants/river-window/README.md",
      "type": "synthetic-voluntary-personal-page"
    }
  ],
  "safety_and_data_release": {
    "minors_personal_data_included": false,
    "contact_information_included": false,
    "precise_locations_included": false,
    "unauthorized_raw_data_included": false,
    "public_data_scope": "仅包含人工生成的模糊分区级合成数据和匿名展示页，不包含真实参与者或原音频。",
    "reviewed_by": "Francis-LQ",
    "reviewed_on": "2026-06-01"
  },
  "publication_review": {
    "status": "approved",
    "reviewed_by": "Francis-LQ",
    "reviewed_on": "2026-06-01",
    "private_paths_included": false,
    "minors_original_audio_included": false,
    "identifiable_conversations_included": false,
    "withdrawal_mapping_recorded": true
  }
}
