{
  "schema_version": "0.2.0",
  "project_id": "your-project-id",
  "title": "项目标题 / Project title",
  "summary": "用一段简短文字说明公共议题、方法和公开成果。",
  "status": "draft",
  "public_issue": "https://github.com/Francis-LQ/ocpc-civic-sensing-lab/issues/new",
  "maintainers": [
    "your-github-account"
  ],
  "themes": [
    "microclimate",
    "soundscape"
  ],
  "protocols": [
    "3 个模糊分区 × 2 个时段",
    "不同手机的 dB 读数仅用于设备内相对比较"
  ],
  "licenses": {
    "code": "MulanPSL-2.0",
    "documents": "MulanOWL-BY-SA-1.0",
    "data": "NOASSERTION"
  },
  "public_artifacts": [
    {
      "path": "README.md",
      "type": "documentation"
    },
    {
      "path": "CONTRIBUTORS.md",
      "type": "contributor-record"
    },
    {
      "path": "RISK_AND_PRIVACY.md",
      "type": "safety-review"
    },
    {
      "path": "PROTOCOL.md",
      "type": "sampling-protocol"
    },
    {
      "path": "RUBRIC.md",
      "type": "learning-rubric"
    },
    {
      "path": "artifacts/observation-template.csv",
      "type": "observation-template"
    }
  ],
  "safety_and_data_release": {
    "minors_personal_data_included": false,
    "contact_information_included": false,
    "precise_locations_included": false,
    "unauthorized_raw_data_included": false,
    "public_data_scope": "仅发布经审核、去标识化的聚合数据和获授权公开成果。",
    "reviewed_by": "your-github-account",
    "reviewed_on": "2026-06-01"
  },
  "publication_review": {
    "status": "draft",
    "reviewed_by": "your-github-account",
    "reviewed_on": "2026-06-01",
    "private_paths_included": false,
    "minors_original_audio_included": false,
    "identifiable_conversations_included": false,
    "withdrawal_mapping_recorded": false
  }
}
